### ISSUE TITLE
Loginserver isn't answering CMD_AUTH_LOGON_CHALLENGE

### ISSUE THREAD

**Issue by NolleVonSalthel** [chromiecraft/chromiecraft#9001]
### Current Behaviour

Login-server stops answering after a successful connection by the client

### Expected Behaviour

Reply with a CMD_AUTH_LOGON_CHALLENGE_Server packet

### Source

Output of Wireshark monitoring the traffic between my machine and the logonserver
|"No."|"Time"|"Source"|"Destination"|"Protocol"|"Length"|"Info"|
|--------|--------|--------|--------|--------|--------|--------|
|"168515"|"2179.399387349"|"redacted"|"46.105.78.215"|"TCP"|"74"|"44538 → 3724 [SYN] Seq=0 Win=64240 Len=0 MSS=1460 SACK_PERM TSval=332358748 TSecr=0 WS=1024"|
|"168516"|"2179.431099358"|"46.105.78.215"|"redacted"|"TCP"|"74"|"3724 → 44538 [SYN, ACK] Seq=0 Ack=1 Win=65160 Len=0 MSS=1420 SACK_PERM TSval=893071655 TSecr=332358748 WS=128"|
|"168517"|"2179.431109338"|"redacted"|"46.105.78.215"|"TCP"|"66"|"44538 → 3724 [ACK] Seq=1 Ack=1 Win=64512 Len=0 TSval=332358780 TSecr=893071655" |
|"168520"|"2179.479724053"|"redacted"|"46.105.78.215"|"WOW"|"111"|"CMD_AUTH_LOGON_CHALLENGE" |
|"168525"|"2179.719008840"|"redacted"|"46.105.78.215"|"TCP"|"111"|"[TCP Retransmission] 44538 → 3724 [PSH, ACK] Seq=1 Ack=1 Win=64512 Len=45 TSval=332359068 TSecr=893071655" |
|"168529"|"2179.959008095"|"redacted"|"46.105.78.215"|"TCP"|"111"|"[TCP Retransmission] 44538 → 3724 [PSH, ACK] Seq=1 Ack=1 Win=64512 Len=45 TSval=332359308 TSecr=893071655" |
|"168541"|"2180.431009334"|"redacted"|"46.105.78.215"|"TCP"|"111"|"[TCP Retransmission] 44538 → 3724 [PSH, ACK] Seq=1 Ack=1 Win=64512 Len=45 TSval=332359780 TSecr=893071655" |
|"168542"|"2180.464168018"|"46.105.78.215"|"redacted"|"TCP"|"74"|"[TCP Retransmission] 3724 → 44538 [SYN, ACK] Seq=0 Ack=1 Win=65160 Len=0 MSS=1420 SACK_PERM TSval=893072688 TSecr=332358748 WS=128" |
|"168543"|"2180.464172328"|"redacted"|"46.105.78.215"|"TCP"|"66"|"[TCP Dup ACK 168517#1] 44538 → 3724 [ACK] Seq=46 Ack=1 Win=64512 Len=0 TSval=332359813 TSecr=893071655" |
|"168553"|"2181.375008683"|"redacted"|"46.105.78.215"|"TCP"|"111"|"[TCP Retransmission] 44538 → 3724 [PSH, ACK] Seq=1 Ack=1 Win=64512 Len=45 TSval=332360724 TSecr=893071655" |
|"168632"|"2182.513503280"|"46.105.78.215"|"redacted"|"TCP"|"74"|"[TCP Retransmission] 3724 → 44538 [SYN, ACK] Seq=0 Ack=1 Win=65160 Len=0 MSS=1420 SACK_PERM TSval=893074737 TSecr=332358748 WS=128"
|"168633"|"2182.513508060"|"redacted"|"46.105.78.215"|"TCP"|"66"|"[TCP Dup ACK 168517#2] 44538 → 3724 [ACK] Seq=46 Ack=1 Win=64512 Len=0 TSval=332361862 TSecr=893071655" |
|"168654"|"2183.295009259"|"redacted"|"46.105.78.215"|"TCP"|"111"|"[TCP Retransmission] 44538 → 3724 [PSH, ACK] Seq=1 Ack=1 Win=64512 Len=45 TSval=332362644 TSecr=893071655" |
|"168880"|"2186.544251964"|"46.105.78.215"|"redacted"|"TCP"|"74"|"[TCP Retransmission] 3724 → 44538 [SYN, ACK] Seq=0 Ack=1 Win=65160 Len=0 MSS=1420 SACK_PERM TSval=893078768 TSecr=332358748 WS=128" |
|"168881"|"2186.544257444"|"redacted"|"46.105.78.215"|"TCP"|"66"|"[TCP Dup ACK 168517#3] 44538 → 3724 [ACK] Seq=46 Ack=1 Win=64512 Len=0 TSval=332365893 TSecr=893071655" |
|"168895"|"2187.071008124"|"redacted"|"46.105.78.215"|"TCP"|"111"|"[TCP Retransmission] 44538 → 3724 [PSH, ACK] Seq=1 Ack=1 Win=64512 Len=45 TSval=332366420 TSecr=893071655" |
|"169194"|"2194.927680173"|"46.105.78.215"|"redacted"|"TCP"|"74"|"[TCP Retransmission] 3724 → 44538 [SYN, ACK] Seq=0 Ack=1 Win=65160 Len=0 MSS=1420 SACK_PERM TSval=893087152 TSecr=332358748 WS=128" |
|"169195"|"2194.927689283"|"redacted"|"46.105.78.215"|"TCP"|"66"|"[TCP Dup ACK 168517#4] 44538 → 3724 [ACK] Seq=46 Ack=1 Win=64512 Len=0 TSval=332374276 TSecr=893071655" |
|"169196"|"2195.007013321"|"redacted"|"46.105.78.215"|"TCP"|"111"|"[TCP Retransmission] 44538 → 3724 [PSH, ACK] Seq=1 Ack=1 Win=64512 Len=45 TSval=332374356 TSecr=893071655" |
|"169633"|"2210.368009993"|"redacted"|"46.105.78.215"|"TCP"|"111"|"[TCP Retransmission] 44538 → 3724 [PSH, ACK] Seq=1 Ack=1 Win=64512 Len=45 TSval=332389717 TSecr=893071655" |
|"170404"|"2240.576010208"|"redacted"|"46.105.78.215"|"TCP"|"111"|"[TCP Retransmission] 44538 → 3724 [PSH, ACK] Seq=1 Ack=1 Win=64512 Len=45 TSval=332419925 TSecr=893071655" |
|"178440"|"2303.551011117"|"redacted"|"46.105.78.215"|"TCP"|"111"|"[TCP Retransmission] 44538 → 3724 [PSH, ACK] Seq=1 Ack=1 Win=64512 Len=45 TSval=332482900 TSecr=893071655" |
|"182049"|"2426.431010185"|"redacted"|"46.105.78.215"|"TCP"|"111"|"[TCP Retransmission] 44538 → 3724 [PSH, ACK] Seq=1 Ack=1 Win=64512 Len=45 TSval=332605780 TSecr=893071655" |

### Steps to reproduce the problem

isn't consistently replicable but happens to multiple people.

### AC rev. hash/commit

https://github.com/chromiecraft/azerothcore-wotlk/commit/871163b1cc22d246b4f6bec09a31116e1a0e5dcf

### Operating system

Ubuntu 22.04

### Modules

- [mod-1v1-arena](https://github.com/azerothcore/mod-1v1-arena)
- [mod-ah-bot](https://github.com/azerothcore/mod-ah-bot)
- [mod-anticheat](https://github.com/azerothcore/mod-anticheat)
- [mod-arena-3v3-solo-queue](https://github.com/azerothcore/mod-arena-3v3-solo-queue)
- [mod-arena-replay](https://github.com/azerothcore/mod-arena-replay)
- [mod-bg-item-reward](https://github.com/azerothcore/mod-bg-item-reward)
- [mod-breaking-news-override](https://github.com/azerothcore/mod-breaking-news-override)
- [mod-cfbg](https://github.com/azerothcore/mod-cfbg)
- [mod-chat-transmitter](https://github.com/azerothcore/mod-chat-transmitter)
- [mod-chromie-xp](https://github.com/azerothcore/mod-chromie-xp)
- [mod-chromiecraft-smartstone](https://github.com/chromiecraft/mod-chromiecraft-smartstone)
- [mod-costumes](https://github.com/azerothcore/mod-costumes)
- [mod-cta-switch](https://github.com/azerothcore/mod-cta-switch)
- [mod-desertion-warnings](https://github.com/azerothcore/mod-desertion-warnings)
- [mod-dmf-switch](https://github.com/azerothcore/mod-dmf-switch)
- [mod-duel-reset](https://github.com/azerothcore/mod-duel-reset)
- [mod-eluna](https://github.com/azerothcore/mod-eluna)
- [mod-evade-logging](https://github.com/heyitsbench/mod-evade-logging)
- [mod-instanced-worldbosses](https://github.com/nyeriah/mod-instanced-worldbosses)
- [mod-ip-tracker](https://github.com/azerothcore/mod-ip-tracker)
- [mod-low-level-arena](https://github.com/azerothcore/mod-low-level-arena)
- [mod-low-level-rbg](https://github.com/azerothcore/mod-low-level-rbg)
- [mod-multi-client-check](https://github.com/azerothcore/mod-multi-client-check)
- [mod-npc-spectator](https://github.com/gozzim/mod-npc-spectator)
- [mod-progression-system](https://github.com/azerothcore/mod-progression-system)
- [mod-pvp-quests](https://github.com/azerothcore/mod-pvp-quests)
- [mod-pvp-titles](https://github.com/azerothcore/mod-pvp-titles)
- [mod-pvpstats-announcer](https://github.com/azerothcore/mod-pvpstats-announcer)
- [mod-queue-list-cache](https://github.com/azerothcore/mod-queue-list-cache)
- [mod-rdf-expansion](https://github.com/azerothcore/mod-rdf-expansion)
- [mod-transmog](https://github.com/azerothcore/mod-transmog)
- [mod-weekend-xp](https://github.com/azerothcore/mod-weekend-xp)
- [mod-zone-difficulty](https://github.com/azerothcore/mod-zone-difficulty)
- [lua-CarbonCopy](https://github.com/55Honey/Acore_CarbonCopy)
- [lua-eventScripts](https://github.com/55Honey/Acore_eventScripts)
- [lua-ExchangeNpc](https://github.com/55Honey/Acore_ExchangeNpc)
- [lua-LevelUpReward](https://github.com/55Honey/Acore_LevelUpReward)
- [lua-RecruitAFriend](https://github.com/55Honey/Acore_RecruitAFriend)
- [lua-SendAndBind](https://github.com/55Honey/Acore_SendAndBind)
- [lua-TempAnnouncements](https://github.com/55Honey/Acore_TempAnnouncements)
- [lua-Zonecheck](https://github.com/55Honey/acore_Zonecheck)

### Server

ChromieCraft
